Row_ID,Chapter,Time/Location,Speaker,Text,Action,Comment_flg,Prev_Row_ID,Next_Row_ID
MoKo11Af-562,WINDS OF CHANGE / FUJIN,,Sindel,"Allow me the privilege, husband.",,N,MoKo11Af-561,MoKo11Af-563
MoKo11Af-563,WINDS OF CHANGE / FUJIN,,Shao Kahn,It will be mine to watch you punish him.,,N,MoKo11Af-562,MoKo11Af-564
MoKo11Af-564,WINDS OF CHANGE / FUJIN,,Sindel,"Your maker sends you to die, Geras.",,N,MoKo11Af-563,MoKo11Af-565
MoKo11Af-565,WINDS OF CHANGE / FUJIN,,Geras,"As she has done billions of times before. Each time, the perfection of her design grows closer.",,N,MoKo11Af-564,MoKo11Af-566
MoKo11Af-566,WINDS OF CHANGE / FUJIN,,,[SINDEL VS GERAS],,Y,MoKo11Af-565,MoKo11Af-567
MoKo11Af-567,WINDS OF CHANGE / FUJIN,,Sindel,"All that grows closer is her defeat, Geras.",,N,MoKo11Af-566,MoKo11Af-568
MoKo11Af-568,WINDS OF CHANGE / FUJIN,,,[She screams at him. Shao Kahn calls for his iconic hammer and smashes Geras' head with a few powerful blows.],,Y,MoKo11Af-567,MoKo11Af-569
MoKo11Af-569,WINDS OF CHANGE / FUJIN,,Shao Kahn,"A thousand years, and you haven't lost a step.",,N,MoKo11Af-568,MoKo11Af-570
MoKo11Af-570,WINDS OF CHANGE / FUJIN,,,[We got back to Kronika’s Tower.],,Y,MoKo11Af-569,MoKo11Af-571
MoKo11Af-571,WINDS OF CHANGE / FUJIN,,Resurrected Liu Kang,Now Shao Kahn turns against us?,,N,MoKo11Af-570,MoKo11Af-572
MoKo11Af-572,WINDS OF CHANGE / FUJIN,,Resurrected Kitana,Perhaps we should send the fleet.,,N,MoKo11Af-571,MoKo11Af-573
MoKo11Af-573,WINDS OF CHANGE / FUJIN,,Kronika,"No. Shao Kahn and Sindel have unwittingly given us back the advantage. Their army will battle Raiden's for possession of my Crown, weakening them both.",,N,MoKo11Af-572,MoKo11Af-574
MoKo11Af-574,WINDS OF CHANGE / FUJIN,,Resurrected Kitana,Then we crush what remains of them with strength to spare.,,N,MoKo11Af-573,MoKo11Af-575
MoKo11Af-575,WINDS OF CHANGE / FUJIN,,Kronika,"The Crown, once again, will be mine. When it is, the New Era will begin.",,N,MoKo11Af-574,MoKo11Af-576
MoKo11Af-576,WINDS OF CHANGE / FUJIN,,,"[Finally, Kharon’s Fleet is set sail in the Sea of Blood. Cassie salutes Young Jax Briggs, who stands on the ship. Some approach her.]",,Y,MoKo11Af-575,MoKo11Af-577
MoKo11Af-577,WINDS OF CHANGE / FUJIN,,Young Johnny Cage,"Captain Cage, reporting for duty, sir! Uh, I mean ma'am!",,N,MoKo11Af-576,MoKo11Af-578
MoKo11Af-578,WINDS OF CHANGE / FUJIN,,Cassie Cage,Whoa there. Nineties Dad. You've already got one bullet wound too many.,,N,MoKo11Af-577,MoKo11Af-579
MoKo11Af-579,WINDS OF CHANGE / FUJIN,,Young Johnny Cage,"I'm healed Cassie. Raiden gave me one of his ""Thunder Hands” massages. Speaking of, where is Mama Bear?",,N,MoKo11Af-578,MoKo11Af-580
MoKo11Af-580,WINDS OF CHANGE / FUJIN,,Cassie Cage,"She's over there, waiting for Sheeva at the rendezvous. But we cast off in five. Where are they?",,N,MoKo11Af-579,MoKo11Af-581
MoKo11Af-581,WINDS OF CHANGE / FUJIN,,,[Suddenly a portal opens and a lot of Shokans run out of it. Soldiers open fire.],,Y,MoKo11Af-580,MoKo11Af-582
MoKo11Af-582,WINDS OF CHANGE / FUJIN,,Cassie Cage,No… No!,,N,MoKo11Af-581,MoKo11Af-583
MoKo11Af-583,WINDS OF CHANGE / FUJIN,,,"[Despite the firearms, the superior number of Shokans is obvious. Young Sonya Blade bravely fights with her pistols, rope and abilities.]",,Y,MoKo11Af-582,MoKo11Af-584
MoKo11Af-584,WINDS OF CHANGE / FUJIN,,Shao Kahn,Try that on me!,,N,MoKo11Af-583,MoKo11Af-585
MoKo11Af-585,WINDS OF CHANGE / FUJIN,,,"[Sonia dodges a hammer, but loses consciousness from Sindel's leg.]",,Y,MoKo11Af-584,MoKo11Af-586
MoKo11Af-586,WINDS OF CHANGE / FUJIN,,Shao Kahn,What a fine trophy for my arena!,,N,MoKo11Af-585,MoKo11Af-587
MoKo11Af-587,WINDS OF CHANGE / FUJIN,,,[Young Johnny Cage and Cassie are running up to them.],,Y,MoKo11Af-586,MoKo11Af-588
MoKo11Af-588,WINDS OF CHANGE / FUJIN,,Young Johnny Cage,"We doing this by gender, or is that sexist?",,N,MoKo11Af-587,MoKo11Af-589
MoKo11Af-589,WINDS OF CHANGE / FUJIN,,Cassie Cage,Just zip it and try not to die.,,N,MoKo11Af-588,MoKo11Af-590
MoKo11Af-590,WINDS OF CHANGE / FUJIN,,Shao Kahn,"Enough prattle, fools. You will bow and serve the Empire.",,N,MoKo11Af-589,MoKo11Af-591
MoKo11Af-591,WINDS OF CHANGE / FUJIN,,Cassie Cage,"Make us, you authoritarian asshole.",,N,MoKo11Af-590,MoKo11Af-592
MoKo11Af-592,WINDS OF CHANGE / FUJIN,,,[You can choose who shut the trap of this little bitch — Sindel or Shao Kahn.],,Y,MoKo11Af-591,MoKo11Af-593
MoKo11Af-593,WINDS OF CHANGE / FUJIN,,Shao Kahn,Deal with the jester. I’ll school this unruly child.,,N,MoKo11Af-592,MoKo11Af-594
MoKo11Af-594,WINDS OF CHANGE / FUJIN,,Cassie Cage,"You school me? Y’know I roasted Shinnok, right?",,N,MoKo11Af-593,MoKo11Af-595
MoKo11Af-595,WINDS OF CHANGE / FUJIN,,Shao Kahn,Ha! Shinnok schemed because he was worthless in battle. That you beat him only proves that truth.,,N,MoKo11Af-594,MoKo11Af-596
MoKo11Af-596,WINDS OF CHANGE / FUJIN,,,[SHAO KAHN VS ARROGANT SCHOOLGIRL],,Y,MoKo11Af-595,MoKo11Af-597
MoKo11Af-597,WINDS OF CHANGE / FUJIN,,Shao Kahn,Now you understand the power.,,N,MoKo11Af-596,MoKo11Af-598
MoKo11Af-598,WINDS OF CHANGE / FUJIN,,,"[After kicking the schoolgirl's ass, Shao Kahn also knocks Young Johnny Cage out with one blow so he doesn't humiliate his wife with his squalor.]",,Y,MoKo11Af-597,MoKo11Af-599
MoKo11Af-599,WINDS OF CHANGE / FUJIN,,Sindel,The poor man is heartbroken.,,N,MoKo11Af-598,MoKo11Af-600
MoKo11Af-600,WINDS OF CHANGE / FUJIN,,Shao Kahn,Why waste tears on weaklings?,,N,MoKo11Af-599,MoKo11Af-601
MoKo11Af-601,WINDS OF CHANGE / FUJIN,,Young Johnny Cage,"Those women are braver and stronger than fifty of you put together! Okay bozos. No jokes, no gimmicks, just kombat. You wanna get nuts?  Let's get nuts!",(laughs) ,N,MoKo11Af-600,MoKo11Af-602
MoKo11Af-602,WINDS OF CHANGE / FUJIN,,,[You can choose to kick the ass of this young talentless actor — Sindel or Shao Kahn.],,Y,MoKo11Af-601,MoKo11Af-603
MoKo11Af-603,WINDS OF CHANGE / FUJIN,,Shao Kahn,"How many of his bones shall I break for you, wife?",,N,MoKo11Af-602,MoKo11Af-604
MoKo11Af-604,WINDS OF CHANGE / FUJIN,,Sindel,Surprise me.,,N,MoKo11Af-603,MoKo11Af-605
MoKo11Af-605,WINDS OF CHANGE / FUJIN,,Shao Kahn," Twice you fought in the tournament, and twice you failed. Why Raiden thought you a contender baffles me.",(to Johnny) ,N,MoKo11Af-604,MoKo11Af-606
MoKo11Af-606,WINDS OF CHANGE / FUJIN,,,[SHAO KAHN VS YOUNG TALENTLESS ACTOR],,Y,MoKo11Af-605,MoKo11Af-607
MoKo11Af-607,WINDS OF CHANGE / FUJIN,,Shao Kahn,Was that your best?,,N,MoKo11Af-606,MoKo11Af-608
MoKo11Af-608,WINDS OF CHANGE / FUJIN,,,[He lifts Johnny off the ground and hits him on the head with his hammer. Sindel claps her hands. Meanwhile Shokan burns the bodies of the Special Forces unit.],,Y,MoKo11Af-607,MoKo11Af-609
MoKo11Af-609,WINDS OF CHANGE / FUJIN,,Shao Kahn,Seize the vessel and dump its cargo! We need speed to overtake Kharon's Fleet!,,N,MoKo11Af-608,MoKo11Af-610
MoKo11Af-610,WINDS OF CHANGE / FUJIN,,,"[Sonia, Johnny and Cassie are chained up and taken to the portal. Meanwhile, on Kharon's ship…]",,Y,MoKo11Af-609,MoKo11Af-611
MoKo11Af-611,WINDS OF CHANGE / FUJIN,,Kitana Kahn,"Raiden and Fujin have gone ahead to storm the Isle but we've lost all contact with our rear guard. Commander Cage, and the Special Forces, Queen Sheeva and the Shokan… and Mother.",,N,MoKo11Af-610,MoKo11Af-612
MoKo11Af-612,WINDS OF CHANGE / FUJIN,,Young Kung Lao,I am just going to say what we are all thinking—,,N,MoKo11Af-611,MoKo11Af-613
MoKo11Af-613,WINDS OF CHANGE / FUJIN,,Kitana Kahn,She did not betray us.,,N,MoKo11Af-612,MoKo11Af-614
MoKo11Af-614,WINDS OF CHANGE / FUJIN,,Young Liu Kang,Let's not jump to conclusions. Look!,,N,MoKo11Af-613,MoKo11Af-615
MoKo11Af-615,WINDS OF CHANGE / FUJIN,,,[They see two ships on the horizon.],,Y,MoKo11Af-614,MoKo11Af-616
MoKo11Af-616,WINDS OF CHANGE / FUJIN,,Young Kung Lao,Is that the Special Forces?,,N,MoKo11Af-615,MoKo11Af-617
MoKo11Af-617,WINDS OF CHANGE / FUJIN,,,[Kitana's looking at the spyglass.],,Y,MoKo11Af-616,MoKo11Af-618
MoKo11Af-618,WINDS OF CHANGE / FUJIN,,Kitana Kahn,"No… Elder Gods damn you, Mother!",,N,MoKo11Af-617,MoKo11Af-619
MoKo11Af-619,WINDS OF CHANGE / FUJIN,,,[At that moment Kronika in her Tower is smiling.],,Y,MoKo11Af-618,MoKo11Af-620
MoKo11Af-620,WINDS OF CHANGE / FUJIN,,Kronika,Kill each other.,,N,MoKo11Af-619,MoKo11Af-621
MoKo11Af-621,WINDS OF CHANGE / FUJIN,,,"[The massacre begins. Kitana, Kung Lao and Liu Kang bravely fight the invaders, while Sindel and Shao Kahn board the ship.]",,Y,MoKo11Af-620,MoKo11Af-622
MoKo11Af-622,WINDS OF CHANGE / FUJIN,,Sindel,Now… Where is Kitana?,,N,MoKo11Af-621,MoKo11Af-623
MoKo11Af-623,WINDS OF CHANGE / FUJIN,,Shao Kahn,No doubt the little princess is hiding.,,N,MoKo11Af-622,MoKo11Af-624
MoKo11Af-624,WINDS OF CHANGE / FUJIN,,,"[Kung Lao’s hat flies by, cutting off some Shokan heads. Sindel catches the hat with two fingers.]",,Y,MoKo11Af-623,MoKo11Af-625
MoKo11Af-625,WINDS OF CHANGE / FUJIN,,Young Kung Lao,"Nobody is hiding, Shao Kahn. Not after your epic failure at the Koliseum. That belongs to me, Sindel.",,N,MoKo11Af-624,MoKo11Af-626
MoKo11Af-626,WINDS OF CHANGE / FUJIN,,Sindel,Have it.,,N,MoKo11Af-625,MoKo11Af-627
MoKo11Af-627,WINDS OF CHANGE / FUJIN,,,[She throws the hat but Kung Lao catches it.],,Y,MoKo11Af-626,MoKo11Af-628
MoKo11Af-628,WINDS OF CHANGE / FUJIN,,Young Kung Lao,I hope you have more than that for the heir of the Great Kung Lao.,,N,MoKo11Af-627,MoKo11Af-629
MoKo11Af-629,WINDS OF CHANGE / FUJIN,,,[You can choose your fighter — Sindel or Shao Kahn.],,Y,MoKo11Af-628,MoKo11Af-630
MoKo11Af-630,WINDS OF CHANGE / FUJIN,,Sindel,"Find Kitana, husband.",,N,MoKo11Af-629,MoKo11Af-631
MoKo11Af-631,WINDS OF CHANGE / FUJIN,,Young Kung Lao,Why am I always right? You're breaking Kitana's heart.,,N,MoKo11Af-630,MoKo11Af-632
MoKo11Af-632,WINDS OF CHANGE / FUJIN,,Sindel,A eunuch monk can't hope to understand the ways of mothers and daughters.,,N,MoKo11Af-631,MoKo11Af-633
MoKo11Af-633,WINDS OF CHANGE / FUJIN,,Young Kung Lao,You did not just call me a eunuch.,,N,MoKo11Af-632,MoKo11Af-634
MoKo11Af-634,WINDS OF CHANGE / FUJIN,,,[SINDEL VS YOUNG KUNG LAO],,Y,MoKo11Af-633,MoKo11Af-635
MoKo11Af-635,WINDS OF CHANGE / FUJIN,,Sindel, I could call you worse.,(laughs) ,N,MoKo11Af-634,MoKo11Af-636
MoKo11Af-636,WINDS OF CHANGE / FUJIN,,Shao Kahn,I have found Kitana. Come!,,N,MoKo11Af-635,MoKo11Af-637
MoKo11Af-637,WINDS OF CHANGE / FUJIN,,,[They defeat Kotal and Jade.],,Y,MoKo11Af-636,MoKo11Af-638
MoKo11Af-638,WINDS OF CHANGE / FUJIN,,Kitana Kahn,"Please, Mother… What spell has Shao Kahn used on you this time?",,N,MoKo11Af-637,MoKo11Af-639
MoKo11Af-639,WINDS OF CHANGE / FUJIN,,Shao Kahn,"Naive girl, your mother is not bewitched. She never has been.",,N,MoKo11Af-638,MoKo11Af-640
MoKo11Af-640,WINDS OF CHANGE / FUJIN,,Kitana Kahn,She had a husband! And a kingdom! And you took them away!,,N,MoKo11Af-639,MoKo11Af-641
MoKo11Af-641,WINDS OF CHANGE / FUJIN,,Sindel,"Oh, Kitana. My first husband, your father, was a fool. Jerrod believed that we were no better than commoners. He refused to assert the privileges of our throne. He traded away our powers, our divine rights. Edenia grew weak and vulnerable. Then Shao Kahn invaded embracing his power, taking what was his. Here was a man unashamed to assert his privilege, and who vowed to protect mine. I had found my true love. And to consecrate our bond… I killed Jerrod for him.",,N,MoKo11Af-640,MoKo11Af-642
MoKo11Af-642,WINDS OF CHANGE / FUJIN,,Young Liu Kang,You love Shao Kahn more than your own daughter?,,N,MoKo11Af-641,MoKo11Af-643
MoKo11Af-643,WINDS OF CHANGE / FUJIN,,Shao Kahn,"Let the women be, Chosen One. You owe me kombat.",,N,MoKo11Af-642,MoKo11Af-644
MoKo11Af-644,WINDS OF CHANGE / FUJIN,,,[You can choose your fighter — Sindel or Shao Kahn.],,Y,MoKo11Af-643,MoKo11Af-645
MoKo11Af-645,WINDS OF CHANGE / FUJIN,,Kitana Kahn,You should have stayed dead.,,N,MoKo11Af-644,MoKo11Af-646
MoKo11Af-646,WINDS OF CHANGE / FUJIN,,Sindel,"Please, that wounds me, daughter.",,N,MoKo11Af-645,MoKo11Af-647
MoKo11Af-647,WINDS OF CHANGE / FUJIN,,Kitana Kahn,I am prepared to do much worse.,,N,MoKo11Af-646,MoKo11Af-648
MoKo11Af-648,WINDS OF CHANGE / FUJIN,,,[SINDEL VS KITANA KAHN],,Y,MoKo11Af-647,MoKo11Af-649
MoKo11Af-649,WINDS OF CHANGE / FUJIN,,Sindel,"Learn or be punished, child.",,N,MoKo11Af-648,MoKo11Af-650
MoKo11Af-650,WINDS OF CHANGE / FUJIN,,,[Meanwhile Shao Kahn defeated Liu Kang. He drags him to his wife. All Shokan and Tarkatan bow to their new leader — Shao Kahn.],,Y,MoKo11Af-649,MoKo11Af-651
MoKo11Af-651,WINDS OF CHANGE / FUJIN,,Shao Kahn,"Kitana was a false Kahn, a traitor to Outworld. She conspired with Raiden to lead you astray!",,N,MoKo11Af-650,MoKo11Af-652
MoKo11Af-652,WINDS OF CHANGE / FUJIN,,Sindel,He seeks Kronika's power… Why? To destroy the Empire! All who followed Kitana are complicit in her treason. Your sentence is death.,,N,MoKo11Af-651,MoKo11Af-653
MoKo11Af-653,WINDS OF CHANGE / FUJIN,,Shao Kahn,"But we will grant clemency now, and riches in the New Era… to all who renounce Kitana and fight under our command.",,N,MoKo11Af-652,MoKo11Af-654
MoKo11Af-654,WINDS OF CHANGE / FUJIN,,,[All Shokan and Tarkatan chant Shao Kahn’s name.],,Y,MoKo11Af-653,MoKo11Af-655
MoKo11Af-655,WINDS OF CHANGE / FUJIN,,Sindel,"Now man the cars, we have a battle to win! For the New Era!",,N,MoKo11Af-654,MoKo11Af-656
MoKo11Af-656,WINDS OF CHANGE / FUJIN,,,"[The defeated, lying on the floor, Liu Kang and Kitana try to reach out with their hands, but Shao Kang breaks Liu Kang's arm with an iron boot.]",,Y,MoKo11Af-655,MoKo11Af-657
MoKo11Af-657,WINDS OF CHANGE / FUJIN,,Sindel,Kitana shall be put in chains. Let her suffer the anguish of defeat. And what of him?,,N,MoKo11Af-656,MoKo11Af-658
MoKo11Af-658,WINDS OF CHANGE / FUJIN,,,"[Shao Kahn calls for his hammer. Meanwhile, the heroes and their huge army of Special Forces land on Kronika's island.]",,Y,MoKo11Af-657,MoKo11Af-659
MoKo11Af-659,CHECKMATE / SHANG TSUNG,,Resurrected Kitana,They are unaware of our army's full strength.,,N,MoKo11Af-658,MoKo11Af-660
MoKo11Af-660,CHECKMATE / SHANG TSUNG,,Resurrected Liu Kang,We will unleash hell.,,N,MoKo11Af-659,MoKo11Af-661
MoKo11Af-661,CHECKMATE / SHANG TSUNG,,Raiden,"We must capture him, quickly.",,N,MoKo11Af-660,MoKo11Af-662
MoKo11Af-662,CHECKMATE / SHANG TSUNG,,Shang Tsung,"Now, Fujin.",,N,MoKo11Af-661,MoKo11Af-663
MoKo11Af-663,CHECKMATE / SHANG TSUNG,,,[He painfully wears the Crown and breaks the gates to the Tower.],,Y,MoKo11Af-662,MoKo11Af-664
MoKo11Af-664,CHECKMATE / SHANG TSUNG,,Fujin,I need but a moment. Lead the charge!,,N,MoKo11Af-663,MoKo11Af-665
MoKo11Af-665,CHECKMATE / SHANG TSUNG,,Jax,Go! I’ll cover him.,,N,MoKo11Af-664,MoKo11Af-666
MoKo11Af-666,CHECKMATE / SHANG TSUNG,,,[Raiden takes the air and leads the army to battle with demons. He comes down from the sky and chops the demons with his electric swords. Resurrected Liu Kang is jump down to face him.],,Y,MoKo11Af-665,MoKo11Af-667
MoKo11Af-667,CHECKMATE / SHANG TSUNG,,Raiden,"Time after time, Kronika's schemes have pitted us against each other. That cycle must end, Liu Kang.",,N,MoKo11Af-666,MoKo11Af-668
MoKo11Af-668,CHECKMATE / SHANG TSUNG,,Resurrected Liu Kang,You will have to kill me.,,N,MoKo11Af-667,MoKo11Af-669
MoKo11Af-669,CHECKMATE / SHANG TSUNG,,Raiden,I would rather save you.,,N,MoKo11Af-668,MoKo11Af-670
MoKo11Af-670,CHECKMATE / SHANG TSUNG,,,[Suddenly Liu Kang’s leg breaks. He falls to the ground in pain.],,Y,MoKo11Af-669,MoKo11Af-671
MoKo11Af-671,CHECKMATE / SHANG TSUNG,,Raiden,By the Elder Gods!,,N,MoKo11Af-670,MoKo11Af-672
MoKo11Af-672,CHECKMATE / SHANG TSUNG,,,[That's because at this very moment Shao Kang breaks Young Liu Kang's leg. Shao Kahn breaks another leg.],,Y,MoKo11Af-671,MoKo11Af-673
MoKo11Af-673,CHECKMATE / SHANG TSUNG,,Resurrected Liu Kang,Shao Kahn… He's smashed my legs!,,N,MoKo11Af-672,MoKo11Af-674
MoKo11Af-674,CHECKMATE / SHANG TSUNG,,Raiden,Shao Kahn?!,,N,MoKo11Af-673,MoKo11Af-675
MoKo11Af-675,CHECKMATE / SHANG TSUNG,,,"[Shao Kahn's ship arrives at the island. When the gangway comes down, Kotal's severed head rolls off it. Shao Kahn commands to charge.]",,Y,MoKo11Af-674,MoKo11Af-676
MoKo11Af-676,CHECKMATE / SHANG TSUNG,,Jax,There's the Sindel I remember.,,N,MoKo11Af-675,MoKo11Af-677
MoKo11Af-677,CHECKMATE / SHANG TSUNG,,Fujin,No rest for the weary. Hold on to me!,,N,MoKo11Af-676,MoKo11Af-678
MoKo11Af-678,CHECKMATE / SHANG TSUNG,,,[They fly forward using Fujin;s wind magic.],,Y,MoKo11Af-677,MoKo11Af-679
MoKo11Af-679,CHECKMATE / SHANG TSUNG,,Raiden,"Fujin, The Crown! I must wield it against Sindel and Shao Kahn!",,N,MoKo11Af-678,MoKo11Af-680
MoKo11Af-680,CHECKMATE / SHANG TSUNG,,Fujin,I will do it. Save your strength for Liu Kang.,,N,MoKo11Af-679,MoKo11Af-681
MoKo11Af-681,CHECKMATE / SHANG TSUNG,,Raiden,"No, brother. The Crown is our burden to share.",,N,MoKo11Af-680,MoKo11Af-682
MoKo11Af-682,CHECKMATE / SHANG TSUNG,,,[Fujin hands the Crown.],,Y,MoKo11Af-681,MoKo11Af-683
MoKo11Af-683,CHECKMATE / SHANG TSUNG,,Raiden, Thank you.,(in Shang Tsung voice) ,N,MoKo11Af-682,MoKo11Af-684
MoKo11Af-684,CHECKMATE / SHANG TSUNG,,,[True Raiden flies in.],,Y,MoKo11Af-683,MoKo11Af-685
MoKo11Af-685,CHECKMATE / SHANG TSUNG,,Raiden,"Your lies are revealed, sorcerer!",,N,MoKo11Af-684,MoKo11Af-686
MoKo11Af-686,CHECKMATE / SHANG TSUNG,,Fujin,Shang Tsung?,,N,MoKo11Af-685,MoKo11Af-687
MoKo11Af-687,CHECKMATE / SHANG TSUNG,,Shang Tsung,"You should be more vigilant, Fujin. Now, bear witness, as the power to decide destiny becomes mine.",,N,MoKo11Af-686,MoKo11Af-688
MoKo11Af-688,CHECKMATE / SHANG TSUNG,,,"[He wears the Crown and a huge stream of green energy surrounds him. Shang Tsung makes yourself young, too.]",,Y,MoKo11Af-687,MoKo11Af-689
MoKo11Af-689,CHECKMATE / SHANG TSUNG,,Fujin,"This has always been your endgame, hasn't it? From the moment you were trapped in the Void.",,N,MoKo11Af-688,MoKo11Af-690
MoKo11Af-690,CHECKMATE / SHANG TSUNG,,Young Shang Tsung,"Kronika was wise to banish me. With this Crown, I am her equal.",,N,MoKo11Af-689,MoKo11Af-691
MoKo11Af-691,CHECKMATE / SHANG TSUNG,,Raiden,Your evil will not triumph!,,N,MoKo11Af-690,MoKo11Af-692
MoKo11Af-692,CHECKMATE / SHANG TSUNG,,,"[He attacks, but Young Shang Tsung has no trouble beating him up.]",,Y,MoKo11Af-691,MoKo11Af-693
MoKo11Af-693,CHECKMATE / SHANG TSUNG,,Young Shang Tsung,All too easy.,,N,MoKo11Af-692,MoKo11Af-694
MoKo11Af-694,CHECKMATE / SHANG TSUNG,,,[He fly to Nightwolf.],,Y,MoKo11Af-693,MoKo11Af-695
MoKo11Af-695,CHECKMATE / SHANG TSUNG,,Young Shang Tsung,How does it feel? Knowing that you will be the last Nightwolf?,,N,MoKo11Af-694,MoKo11Af-696
MoKo11Af-696,CHECKMATE / SHANG TSUNG,,Nightwolf,"The Great Spirit will choose another. I may die, but the mantle will live on.",,N,MoKo11Af-695,MoKo11Af-697
MoKo11Af-697,CHECKMATE / SHANG TSUNG,,,[YOUNG SHANG TSUNG VS NIGHTWOLF],,Y,MoKo11Af-696,MoKo11Af-698
MoKo11Af-698,CHECKMATE / SHANG TSUNG,,Young Shang Tsung,Fool. The mantle dies with you.,,N,MoKo11Af-697,MoKo11Af-699
MoKo11Af-699,CHECKMATE / SHANG TSUNG,,Fujin,His soul is not yours to take!,,N,MoKo11Af-698,MoKo11Af-700
MoKo11Af-700,CHECKMATE / SHANG TSUNG,,Young Shang Tsung,"His soul and yours, are mine.",,N,MoKo11Af-699,MoKo11Af-701
MoKo11Af-701,CHECKMATE / SHANG TSUNG,,Raiden,"You think us unprepared? Your treachery is expected, sorcerer.",,N,MoKo11Af-700,MoKo11Af-702
MoKo11Af-702,CHECKMATE / SHANG TSUNG,,Fujin,You are incapable of choosing the righteous path.,,N,MoKo11Af-701,MoKo11Af-703
MoKo11Af-703,CHECKMATE / SHANG TSUNG,,Young Shang Tsung,The path I chose ends with your souls sworn to my service. That future is now undeniable.,,N,MoKo11Af-702,MoKo11Af-704
MoKo11Af-704,CHECKMATE / SHANG TSUNG,,,[YOUNG SHANG TSUNG VS FUJIN],,Y,MoKo11Af-703,MoKo11Af-705
MoKo11Af-705,CHECKMATE / SHANG TSUNG,,Young Shang Tsung,"Now, I choose your destiny.",,N,MoKo11Af-704,MoKo11Af-706
MoKo11Af-706,CHECKMATE / SHANG TSUNG,,,[He sucks the soul out of Raiden and Fujin.],,Y,MoKo11Af-705,MoKo11Af-707
MoKo11Af-707,CHECKMATE / SHANG TSUNG,,Shao Kahn,Let's finish them.,,N,MoKo11Af-706,MoKo11Af-708
MoKo11Af-708,CHECKMATE / SHANG TSUNG,,Sindel,With pleasure.,,N,MoKo11Af-707,MoKo11Af-709
MoKo11Af-709,CHECKMATE / SHANG TSUNG,,Young Shang Tsung,No. Keep them alive. We can siphon their powers for eternity.,,N,MoKo11Af-708,MoKo11Af-710
MoKo11Af-710,CHECKMATE / SHANG TSUNG,,Shao Kahn,All the better.,,N,MoKo11Af-709,MoKo11Af-711
MoKo11Af-711,CHECKMATE / SHANG TSUNG,,,"[Meanwhile, at the top of the Tower…]",,Y,MoKo11Af-710,MoKo11Af-712
MoKo11Af-712,CHECKMATE / SHANG TSUNG,,Resurrected Kitana,"What now, Kronika? Shang Tsung has breached our defenses.",,N,MoKo11Af-711,MoKo11Af-713
MoKo11Af-713,CHECKMATE / SHANG TSUNG,,Kronika,"Victory is still at hand. We will put down Shang Tsung's defiance. But you will require more assistance. Dearest Cetrion, you have served me admirably. Now there is one final service you must perform.",,N,MoKo11Af-712,MoKo11Af-714
MoKo11Af-714,CHECKMATE / SHANG TSUNG,,Cetrion,"Yes, mother… I understand.",,N,MoKo11Af-713,MoKo11Af-715
MoKo11Af-715,CHECKMATE / SHANG TSUNG,,,"[She kills herself and Kronika absorbs her power. Meanwhile, Young Shang Tsung, Sindel and Shao Kahn standing at her door.]",,Y,MoKo11Af-714,MoKo11Af-716
MoKo11Af-716,CHECKMATE / SHANG TSUNG,,Young Shang Tsung,The Hourglass awaits.,,N,MoKo11Af-715,MoKo11Af-717
MoKo11Af-717,CHECKMATE / SHANG TSUNG,,Shao Kahn,Beyond that door: ultimate power.,,N,MoKo11Af-716,MoKo11Af-718
MoKo11Af-718,CHECKMATE / SHANG TSUNG,,Sindel,It will be our privilege to wield it.,,N,MoKo11Af-717,MoKo11Af-719
MoKo11Af-719,CHECKMATE / SHANG TSUNG,,Young Shang Tsung,"Please, allow me.",,N,MoKo11Af-718,MoKo11Af-720
MoKo11Af-720,CHECKMATE / SHANG TSUNG,,,[He opens the door gently and carefully with his green magic.],,Y,MoKo11Af-719,MoKo11Af-721
MoKo11Af-721,CHECKMATE / SHANG TSUNG,,Kronika,"Shang Tsung, pretender to my role. Your strategy has been novel. But in the end, you will not prevail. Finish them.",,N,MoKo11Af-720,MoKo11Af-722
MoKo11Af-722,CHECKMATE / SHANG TSUNG,,,"[Young Shang Tsung, Sindel and Shao Kang begin to fight Resurrected Kung Lao, Kitana and Jade. They kill them all. Young Shang Tsung takes the form of Kung Lao and shoots down Kronika, soaring in the air.]",,Y,MoKo11Af-721,MoKo11Af-723
MoKo11Af-723,CHECKMATE / SHANG TSUNG,,Shao Kahn,"How easily you are felled, Kronika. Once your power's mine, I will rule eternity!",,N,MoKo11Af-722,MoKo11Af-724
MoKo11Af-724,CHECKMATE / SHANG TSUNG,,,[But then Young Shang Tsung betrays them! He throws them on the floor with his fire magic.],,Y,MoKo11Af-723,MoKo11Af-725
MoKo11Af-725,CHECKMATE / SHANG TSUNG,,Young Shang Tsung,"Killing Kronika is my destiny. Yours to serve me. My obedient subjects, projecting my influence throughout the realms.",,N,MoKo11Af-724,MoKo11Af-726
MoKo11Af-726,CHECKMATE / SHANG TSUNG,,Shao Kahn,"You're drunk on the Crown's power, Shang Tsung. In your stupor, you forget your place.",,N,MoKo11Af-725,MoKo11Af-727
MoKo11Af-727,CHECKMATE / SHANG TSUNG,,Sindel,"He is a dog who betrays his masters. Come, let's put him down.",,N,MoKo11Af-726,MoKo11Af-728
MoKo11Af-728,CHECKMATE / SHANG TSUNG,,,[YOUNG SHANG TSUNG VS SHAO KAHN & SINDEL],,Y,MoKo11Af-727,MoKo11Af-729
MoKo11Af-729,CHECKMATE / SHANG TSUNG,,Young Shang Tsung,My service to you is over.,,N,MoKo11Af-728,MoKo11Af-730
MoKo11Af-730,CHECKMATE / SHANG TSUNG,,,[He sucks out their souls.],,Y,MoKo11Af-729,MoKo11Af-731
MoKo11Af-731,CHECKMATE / SHANG TSUNG,,Young Shang Tsung,Now yours to me begins.,,N,MoKo11Af-730,MoKo11Af-732
MoKo11Af-732,CHECKMATE / SHANG TSUNG,,Kronika,You have no one left to betray.,,N,MoKo11Af-731,MoKo11Af-733
MoKo11Af-733,CHECKMATE / SHANG TSUNG,,Young Shang Tsung,"Concede Kronika, while you have time. I'll let you live, to serve me in my New Era. Or would you prefer to be wiped from history?",,N,MoKo11Af-732,MoKo11Af-734
MoKo11Af-734,CHECKMATE / SHANG TSUNG,,Kronika,Sculpting the Sands of Time requires great power and skill. You may wear my Crown but you are not a Titan!,,N,MoKo11Af-733,MoKo11Af-735
MoKo11Af-735,CHECKMATE / SHANG TSUNG,,,[YOUNG SHANG TSUNG VS KRONIKA],,Y,MoKo11Af-734,MoKo11Af-736
MoKo11Af-736,CHECKMATE / SHANG TSUNG,,Young Shang Tsung,Destiny is mine.,,N,MoKo11Af-735,MoKo11Af-737
MoKo11Af-737,CHECKMATE / SHANG TSUNG,,,[Beaten Kronika crawling on the floor.],,Y,MoKo11Af-736,MoKo11Af-738
MoKo11Af-738,CHECKMATE / SHANG TSUNG,,Young Shang Tsung,"You should have accepted my offer, Kronika. I would have allowed you to wield great influence. Surely service is better than death.",,N,MoKo11Af-737,MoKo11Af-739
MoKo11Af-739,CHECKMATE / SHANG TSUNG,,Kronika,I do not serve. I am a Titan.,,N,MoKo11Af-738,MoKo11Af-740
MoKo11Af-740,CHECKMATE / SHANG TSUNG,,Young Shang Tsung," You were, Kronika.",(laughs) ,N,MoKo11Af-739,MoKo11Af-741
MoKo11Af-741,CHECKMATE / SHANG TSUNG,,,[He sucks her soul.],,Y,MoKo11Af-740,MoKo11Af-742
MoKo11Af-742,CHECKMATE / SHANG TSUNG,,Young Shang Tsung,Time and destiny are now mine to command. Every realm will bend to my will.,,N,MoKo11Af-741,MoKo11Af-743
MoKo11Af-743,CHECKMATE / SHANG TSUNG,,,[He starts… creating. Suddenly a fire portal opens.],,Y,MoKo11Af-742,MoKo11Af-744
MoKo11Af-744,CHECKMATE / SHANG TSUNG,,Fire God Liu Kang,Cease! Before you doom us all.,,N,MoKo11Af-743,MoKo11Af-745
MoKo11Af-745,CHECKMATE / SHANG TSUNG,,Young Shang Tsung,Liu Kang. I thought your duties required that you stay behind.,,N,MoKo11Af-744,MoKo11Af-746
MoKo11Af-746,CHECKMATE / SHANG TSUNG,,Fire God Liu Kang,"A lie, something you know well.",,N,MoKo11Af-745,MoKo11Af-747
MoKo11Af-747,CHECKMATE / SHANG TSUNG,,Young Shang Tsung,"I see now. The Hourglass showed that only I could wield the Crown against Kronika, successfully. You let me win. And to ensure victory, you sacrificed the lives of your friends. How deliciously cold-blooded.",,N,MoKo11Af-746,MoKo11Af-748
MoKo11Af-748,CHECKMATE / SHANG TSUNG,,Fire God Liu Kang,"They are not gone, Shang Tsung. They will live again in my New Era.",,N,MoKo11Af-747,MoKo11Af-749
