Row_ID,Chapter,Time/Location,Speaker,Text,Action,Comment_flg,Prev_Row_ID,Next_Row_ID
MoKo11Af-374,WINDS OF CHANGE / FUJIN,,,"[Suddenly, the ceiling collapses. Sindel's going down. Sharp tentacles come down, grab her and lift her to the top.]",,Y,MoKo11Af-373,MoKo11Af-375
MoKo11Af-375,WINDS OF CHANGE / FUJIN,,Cetrion,You were to defeat me?,,N,MoKo11Af-374,MoKo11Af-376
MoKo11Af-376,WINDS OF CHANGE / FUJIN,,Sindel,I am not finished yet!,,N,MoKo11Af-375,MoKo11Af-377
MoKo11Af-377,WINDS OF CHANGE / FUJIN,,,"[She rips the tentacles with her hair and falls to the ground painfully. Nightwolf is trying to attack Cetrion, but without success.]",,Y,MoKo11Af-376,MoKo11Af-378
MoKo11Af-378,WINDS OF CHANGE / FUJIN,,Cetrion,Abide Kronika's will!,,N,MoKo11Af-377,MoKo11Af-379
MoKo11Af-379,WINDS OF CHANGE / FUJIN,,,[Nightwolf reads a spell and places the Cetrion on the column of light. Sindel throws Cetrion with her hair.],,Y,MoKo11Af-378,MoKo11Af-380
MoKo11Af-380,WINDS OF CHANGE / FUJIN,,Sindel,Can you fight?,,N,MoKo11Af-379,MoKo11Af-381
MoKo11Af-381,WINDS OF CHANGE / FUJIN,,Nightwolf,I’ll do what I can.,,N,MoKo11Af-380,MoKo11Af-382
MoKo11Af-382,WINDS OF CHANGE / FUJIN,,Cetrion,Kronika offered the future but instead you will have none. Blame only yourselves for this fate.,,N,MoKo11Af-381,MoKo11Af-383
MoKo11Af-383,WINDS OF CHANGE / FUJIN,,,[SINDEL VS CETRION],,Y,MoKo11Af-382,MoKo11Af-384
MoKo11Af-384,WINDS OF CHANGE / FUJIN,,Sindel,"It is your fate that should concern you, Cetrion.",,N,MoKo11Af-383,MoKo11Af-385
MoKo11Af-385,WINDS OF CHANGE / FUJIN,,,[She screams at her and Cetrion rolls away. Fujin and Shang Tsung jumped to the surface. Together they finish her — Shang Tsung’s fiery snake eats Cetrion alive. Jax is standing nearby and he's kinda freaking out about what's going on. Fujin heals Nightwolf.],,Y,MoKo11Af-384,MoKo11Af-386
MoKo11Af-386,WINDS OF CHANGE / FUJIN,,Fujin,"Well, Shung Ting your strategy proved sound after all.",,N,MoKo11Af-385,MoKo11Af-387
MoKo11Af-387,WINDS OF CHANGE / FUJIN,,Shang Tsung,Of course it did.,,N,MoKo11Af-386,MoKo11Af-388
MoKo11Af-388,WINDS OF CHANGE / FUJIN,,,[Young Jax and a group of soldiers rushes in.],,Y,MoKo11Af-387,MoKo11Af-389
MoKo11Af-389,WINDS OF CHANGE / FUJIN,,Young Jax Briggs,"Hands over your head, Shang Tsung.",,N,MoKo11Af-388,MoKo11Af-390
MoKo11Af-390,WINDS OF CHANGE / FUJIN,,Jaсqui Briggs,"You too, Sindel. That hair so much as twitches—",,N,MoKo11Af-389,MoKo11Af-391
MoKo11Af-391,WINDS OF CHANGE / FUJIN,,Jax,"Ease up, baby girl.",,N,MoKo11Af-390,MoKo11Af-392
MoKo11Af-392,WINDS OF CHANGE / FUJIN,,Jaсqui Briggs,Dad? How did you get here?,,N,MoKo11Af-391,MoKo11Af-393
MoKo11Af-393,WINDS OF CHANGE / FUJIN,,Jax,We're all on the same side against Kronika.,,N,MoKo11Af-392,MoKo11Af-394
MoKo11Af-394,WINDS OF CHANGE / FUJIN,,Fujin,"Yes, and now we must bring this to Raiden.",,N,MoKo11Af-393,MoKo11Af-395
MoKo11Af-395,WINDS OF CHANGE / FUJIN,,,[He takes out the crown.],,Y,MoKo11Af-394,MoKo11Af-396
MoKo11Af-396,WINDS OF CHANGE / FUJIN,,Jaсqui Briggs,Is that a crown?,,N,MoKo11Af-395,MoKo11Af-397
MoKo11Af-397,WINDS OF CHANGE / FUJIN,,Fujin,"Kronika's Crown. Without it, she lacks the power to restart history.",,N,MoKo11Af-396,MoKo11Af-398
MoKo11Af-398,WINDS OF CHANGE / FUJIN,,Young Jax Briggs,About time we had some good news.,,N,MoKo11Af-397,MoKo11Af-399
MoKo11Af-399,WINDS OF CHANGE / FUJIN,,Nightwolf,"Now that we have this, we're in uncharted territory. We've changed this timeline for good.",,N,MoKo11Af-398,MoKo11Af-400
MoKo11Af-400,WINDS OF CHANGE / FUJIN,,Shang Tsung,Correct. No one can predict what happens next. Not even me.,,N,MoKo11Af-399,MoKo11Af-401
MoKo11Af-401,WINDS OF CHANGE / FUJIN,,Sindel,"I must return to Outworld, to aid Kitana Kahn.",,N,MoKo11Af-400,MoKo11Af-402
MoKo11Af-402,WINDS OF CHANGE / FUJIN,,Fujin,Thank you for aiding us. We will rendervous at the Sea of Blood in six hours.,,N,MoKo11Af-401,MoKo11Af-403
MoKo11Af-403,WINDS OF CHANGE / FUJIN,,Sindel,Until our next battle.,,N,MoKo11Af-402,MoKo11Af-404
MoKo11Af-404,WINDS OF CHANGE / FUJIN,,,[Shang Tsung opens a portal. Sindel walks into it.],,Y,MoKo11Af-403,MoKo11Af-405
MoKo11Af-405,WINDS OF CHANGE / FUJIN,,Sindel,Sorcerer.,,N,MoKo11Af-404,MoKo11Af-406
MoKo11Af-406,WINDS OF CHANGE / FUJIN,,Nightwolf,I’ll go with the Briggs family to brief the Special Forces.,,N,MoKo11Af-405,MoKo11Af-407
MoKo11Af-407,WINDS OF CHANGE / FUJIN,,Fujin,May the Great Spirit protect you.,,N,MoKo11Af-406,MoKo11Af-408
MoKo11Af-408,WINDS OF CHANGE / FUJIN,,Nightwolf,"May she protect you, Fujin, when Raiden lays eyes on you with Shang Tsung.",,N,MoKo11Af-407,MoKo11Af-409
MoKo11Af-409,WINDS OF CHANGE / FUJIN,,,"[Cetrion, defeated, returns to Kronika.]",,Y,MoKo11Af-408,MoKo11Af-410
MoKo11Af-410,WINDS OF CHANGE / FUJIN,,Kronika,"Without the Crown, there can be no New Era.",,N,MoKo11Af-409,MoKo11Af-411
MoKo11Af-411,WINDS OF CHANGE / FUJIN,,Cetrion,This failure rests on my shoulders.,,N,MoKo11Af-410,MoKo11Af-412
MoKo11Af-412,WINDS OF CHANGE / FUJIN,,Kronika,"No. I underestimated Shang Tsung's ingenuity. To escape the Void, to return from the future…",,N,MoKo11Af-411,MoKo11Af-413
MoKo11Af-413,WINDS OF CHANGE / FUJIN,,Cetrion,"I will face him again, mother. This time I will succeed.",,N,MoKo11Af-412,MoKo11Af-414
MoKo11Af-414,WINDS OF CHANGE / FUJIN,,Kronika,"I must go. With Shang Tsung in possession of the Crown, he's become far too dangerous. And I doubt his new allies realize quite how dangerous he is.",,N,MoKo11Af-413,MoKo11Af-415
MoKo11Af-415,WINDS OF CHANGE / FUJIN,,,"[We're moving to the Fire Gardens where Sub-Zero awaits the return of Scorpion, who must persuade Kharon to share his fleet.]",,Y,MoKo11Af-414,MoKo11Af-416
MoKo11Af-416,WINDS OF CHANGE / FUJIN,,Sub-Zero,"Your Shaolin masters, they are ready?",,N,MoKo11Af-415,MoKo11Af-417
MoKo11Af-417,WINDS OF CHANGE / FUJIN,,Young Liu Kang,They will fight until the last man.,,N,MoKo11Af-416,MoKo11Af-418
MoKo11Af-418,WINDS OF CHANGE / FUJIN,,Sub-Zero,That is likely what it will take.,,N,MoKo11Af-417,MoKo11Af-419
MoKo11Af-419,WINDS OF CHANGE / FUJIN,,Young Liu Kang,There will not be a fight if Kharon does not help us. Is there any word from Grandmaster Hasashi?,,N,MoKo11Af-418,MoKo11Af-420
MoKo11Af-420,WINDS OF CHANGE / FUJIN,,Sub-Zero,No. If we do not hear soon I will return to the Netherrealm.,,N,MoKo11Af-419,MoKo11Af-421
MoKo11Af-421,WINDS OF CHANGE / FUJIN,,,[Scorpion appears.],,Y,MoKo11Af-420,MoKo11Af-422
MoKo11Af-422,WINDS OF CHANGE / FUJIN,,Young Liu Kang,Wrong Scorpion. This cannot be good.,,N,MoKo11Af-421,MoKo11Af-423
MoKo11Af-423,WINDS OF CHANGE / FUJIN,,Sub-Zero,Get Raiden.,,N,MoKo11Af-422,MoKo11Af-424
MoKo11Af-424,WINDS OF CHANGE / FUJIN,,Scorpion,"The Fire Gardens, rebuilt? The Shirai Ryu are indeed restored.",,N,MoKo11Af-423,MoKo11Af-425
MoKo11Af-425,WINDS OF CHANGE / FUJIN,,Sub-Zero,"Why are you here, Scorpion? Where is Grandmaster Hasashi?",,N,MoKo11Af-424,MoKo11Af-426
MoKo11Af-426,WINDS OF CHANGE / FUJIN,,Scorpion,He is dead.,,N,MoKo11Af-425,MoKo11Af-427
MoKo11Af-427,WINDS OF CHANGE / FUJIN,,Sub-Zero,And now you've come to finish us.,,N,MoKo11Af-426,MoKo11Af-428
MoKo11Af-428,WINDS OF CHANGE / FUJIN,,Scorpion,"I understand your mistrust, but I am here to assist you!",,N,MoKo11Af-427,MoKo11Af-429
MoKo11Af-429,WINDS OF CHANGE / FUJIN,,Sub-Zero,I find that impossible to believe.,,N,MoKo11Af-428,MoKo11Af-430
MoKo11Af-430,WINDS OF CHANGE / FUJIN,,,"[Suddenly Shang Tsung appears, disrupting the flow of time.]",,Y,MoKo11Af-429,MoKo11Af-431
MoKo11Af-431,WINDS OF CHANGE / FUJIN,,Sub-Zero, What is doing here?,(to Scorpion) ,N,MoKo11Af-430,MoKo11Af-432
MoKo11Af-432,WINDS OF CHANGE / FUJIN,,Shang Tsung,We are not together.,,N,MoKo11Af-431,MoKo11Af-433
MoKo11Af-433,WINDS OF CHANGE / FUJIN,,Sub-Zero, If you are here to help prove it. Join me against the sorcerer.,(to Scorpion) ,N,MoKo11Af-432,MoKo11Af-434
MoKo11Af-434,WINDS OF CHANGE / FUJIN,,Scorpion,I shall.,,N,MoKo11Af-433,MoKo11Af-435
MoKo11Af-435,WINDS OF CHANGE / FUJIN,,,[Fujin walks out of the portal.],,Y,MoKo11Af-434,MoKo11Af-436
MoKo11Af-436,WINDS OF CHANGE / FUJIN,,Sub-Zero,Fujin?! Raiden thought you lost when the timeline was broken… But you stand with Shang Tsung?!,,N,MoKo11Af-435,MoKo11Af-437
MoKo11Af-437,WINDS OF CHANGE / FUJIN,,Fujin,"We have urgent news for Raiden. Please, let us pass!",,N,MoKo11Af-436,MoKo11Af-438
MoKo11Af-438,WINDS OF CHANGE / FUJIN,,Sub-Zero,This may be the sorcerer's trick.,,N,MoKo11Af-437,MoKo11Af-439
MoKo11Af-439,WINDS OF CHANGE / FUJIN,,Scorpion,The Fire Gardens will not be defiled by his presence.,,N,MoKo11Af-438,MoKo11Af-440
MoKo11Af-440,WINDS OF CHANGE / FUJIN,,,[Sub-Zero freezes Shang Tsung.],,Y,MoKo11Af-439,MoKo11Af-441
MoKo11Af-441,WINDS OF CHANGE / FUJIN,,Sub-Zero,"Why you have joined Shang Tsung is beyond me, Fujin. What has he done to corrupt your mind?",,N,MoKo11Af-440,MoKo11Af-442
MoKo11Af-442,WINDS OF CHANGE / FUJIN,,,[FUJIN VS SUB-ZERO],,Y,MoKo11Af-441,MoKo11Af-443
MoKo11Af-443,WINDS OF CHANGE / FUJIN,,Fujin,Perhaps listen before you judge.,,N,MoKo11Af-442,MoKo11Af-444
MoKo11Af-444,WINDS OF CHANGE / FUJIN,,,[He broke the ice with Shang Tsung. I mean he shot him and the ice shutters.],,Y,MoKo11Af-443,MoKo11Af-445
MoKo11Af-445,WINDS OF CHANGE / FUJIN,,Shang Tsung,"Thank you, Fujin.",,N,MoKo11Af-444,MoKo11Af-446
MoKo11Af-446,WINDS OF CHANGE / FUJIN,,Fujin,The storm is not yet passed.,,N,MoKo11Af-445,MoKo11Af-447
MoKo11Af-447,WINDS OF CHANGE / FUJIN,,,[Young Liu Kang brings Raiden.],,Y,MoKo11Af-446,MoKo11Af-448
MoKo11Af-448,WINDS OF CHANGE / FUJIN,,Raiden,Shang Tsung!,,N,MoKo11Af-447,MoKo11Af-449
MoKo11Af-449,WINDS OF CHANGE / FUJIN,,Fujin,"We must speak with you, brother.",,N,MoKo11Af-448,MoKo11Af-450
MoKo11Af-450,WINDS OF CHANGE / FUJIN,,Raiden,"""We,"" Fujin? Since when are you friends with this filth?",,N,MoKo11Af-449,MoKo11Af-451
MoKo11Af-451,WINDS OF CHANGE / FUJIN,,Shang Tsung,"I am here to save you, Raiden.",,N,MoKo11Af-450,MoKo11Af-452
MoKo11Af-452,WINDS OF CHANGE / FUJIN,,Fujin,"We all from your tragic future. In it, Liu Kang defeated Kronika, but their battle destroyed her Crown. Without this, the broken timeline couldn't be repaired.",,N,MoKo11Af-451,MoKo11Af-453
MoKo11Af-453,WINDS OF CHANGE / FUJIN,,Shang Tsung,"Our only hope was to return here, steal the Crown, and make use of its power.",,N,MoKo11Af-452,MoKo11Af-454
MoKo11Af-454,WINDS OF CHANGE / FUJIN,,Fujin,"Now, we can change the outcome of the fight against Kronika. We can defeat her and fix time!",,N,MoKo11Af-453,MoKo11Af-455
MoKo11Af-455,WINDS OF CHANGE / FUJIN,,Raiden,"I had never thought you gullible, brother. Shang Tsung's schemes serve only to benefit him! How could you fall for such lies?!",,N,MoKo11Af-454,MoKo11Af-456
MoKo11Af-456,WINDS OF CHANGE / FUJIN,,,[He takes out Shinnok's amulet.],,Y,MoKo11Af-455,MoKo11Af-457
MoKo11Af-457,WINDS OF CHANGE / FUJIN,,Shang Tsung,"Be rational, Raiden—",,N,MoKo11Af-456,MoKo11Af-458
MoKo11Af-458,WINDS OF CHANGE / FUJIN,,Raiden,"Spread your falsehoods elsewhere, sorcerer! You will not deceive us!",,N,MoKo11Af-457,MoKo11Af-459
MoKo11Af-459,WINDS OF CHANGE / FUJIN,,Young Liu Kang,Lord Raiden! We should listen. He may be telling the truth.,,N,MoKo11Af-458,MoKo11Af-460
MoKo11Af-460,WINDS OF CHANGE / FUJIN,,Raiden,There is only one way to find out.,,N,MoKo11Af-459,MoKo11Af-461
MoKo11Af-461,WINDS OF CHANGE / FUJIN,,,[He hits Shang Tsung with the power of amulet.],,Y,MoKo11Af-460,MoKo11Af-462
MoKo11Af-462,WINDS OF CHANGE / FUJIN,,Raiden,"Now, Shang Tsung. The truth!",,N,MoKo11Af-461,MoKo11Af-463
MoKo11Af-463,WINDS OF CHANGE / FUJIN,,Young Liu Kang,"Raiden, stop this!",,N,MoKo11Af-462,MoKo11Af-464
MoKo11Af-464,WINDS OF CHANGE / FUJIN,,Raiden,"Step aside, Liu Kang.",,N,MoKo11Af-463,MoKo11Af-465
MoKo11Af-465,WINDS OF CHANGE / FUJIN,,Young Liu Kang,Put down the amulet! Its darkness is taking hold of you!,,N,MoKo11Af-464,MoKo11Af-466
MoKo11Af-466,WINDS OF CHANGE / FUJIN,,,[He hits Young Liu Kang too.],,Y,MoKo11Af-465,MoKo11Af-467
MoKo11Af-467,WINDS OF CHANGE / FUJIN,,Raiden,You also betray me!,,N,MoKo11Af-466,MoKo11Af-468
MoKo11Af-468,WINDS OF CHANGE / FUJIN,,Young Liu Kang,This is not the way. Shang Tsung is not the enemy this time.,,N,MoKo11Af-467,MoKo11Af-469
MoKo11Af-469,WINDS OF CHANGE / FUJIN,,,"[Raiden is going to hit Young Liu Kang again, but Fujin knocks the amulet out of his hands with magic.]",,Y,MoKo11Af-468,MoKo11Af-470
MoKo11Af-470,WINDS OF CHANGE / FUJIN,,Raiden,The realms hang in the balance and you form this unholy alliance?!,,N,MoKo11Af-469,MoKo11Af-471
MoKo11Af-471,WINDS OF CHANGE / FUJIN,,,[He turns himself into Evil Raiden.],,Y,MoKo11Af-470,MoKo11Af-472
MoKo11Af-472,WINDS OF CHANGE / FUJIN,,Evil Raiden,"Enough of this madness. If you both must die, so be it!",,N,MoKo11Af-471,MoKo11Af-473
MoKo11Af-473,WINDS OF CHANGE / FUJIN,,Fujin,My brother is my problem. I will signal if I need help. Shinnok's Amulet inflames your anger and clouds your judgement. Have faith in me.,,N,MoKo11Af-472,MoKo11Af-474
MoKo11Af-474,WINDS OF CHANGE / FUJIN,,,[FUJIN VS EVIL RAIDEN],,Y,MoKo11Af-473,MoKo11Af-475
MoKo11Af-475,WINDS OF CHANGE / FUJIN,,Fujin,"Now listen, brother. We're running out of time.",,N,MoKo11Af-474,MoKo11Af-476
MoKo11Af-476,WINDS OF CHANGE / FUJIN,,,[Evil Raiden is turning into a regular Raiden. He picks up Shinnok’s Amulet from the ground.],,Y,MoKo11Af-475,MoKo11Af-477
MoKo11Af-477,WINDS OF CHANGE / FUJIN,,Raiden,I am a fool. I have allowed myself to become a slave to anger. I will not allow my temper to fracture our resolve further.,,N,MoKo11Af-476,MoKo11Af-478
MoKo11Af-478,WINDS OF CHANGE / FUJIN,,,"[Shang Tsung is smiling. Fujin tells Raiden, Young Liu Kang and the others what will happen in the future.]",,Y,MoKo11Af-477,MoKo11Af-479
MoKo11Af-479,WINDS OF CHANGE / FUJIN,,Young Liu Kang,"Surely you jest, Lord Fujin.",,N,MoKo11Af-478,MoKo11Af-480
MoKo11Af-480,WINDS OF CHANGE / FUJIN,,Fujin,"Not all, Liu Kang. Raiden's power makes you a Fire God.",,N,MoKo11Af-479,MoKo11Af-481
MoKo11Af-481,WINDS OF CHANGE / FUJIN,,Young Kung Lao,Of course it does.,,N,MoKo11Af-480,MoKo11Af-482
MoKo11Af-482,WINDS OF CHANGE / FUJIN,,Raiden,"Unfortunately, I cannot transfer my power to Liu Kang yet. First I must free his Revenant from Quan Chi's curse.",,N,MoKo11Af-481,MoKo11Af-483
MoKo11Af-483,WINDS OF CHANGE / FUJIN,,Fujin,We will face the Revenants cool enough.,,N,MoKo11Af-482,MoKo11Af-484
MoKo11Af-484,WINDS OF CHANGE / FUJIN,,Raiden,What else can you tell us about the final battle? We must use every advantage.,,N,MoKo11Af-483,MoKo11Af-485
MoKo11Af-485,WINDS OF CHANGE / FUJIN,,,"[Unexpectedly, the sands of time hit the heroes. Everyone but Raiden, Fujin and Shang Tsung are frozen in time.]",,Y,MoKo11Af-484,MoKo11Af-486
MoKo11Af-486,WINDS OF CHANGE / FUJIN,,Kronika,"Lord Fujin, Shang Tsung. I trust you are enjoying your travels?",,N,MoKo11Af-485,MoKo11Af-487
MoKo11Af-487,WINDS OF CHANGE / FUJIN,,Fujin,"You have already been defeated once, Kronika.",,N,MoKo11Af-486,MoKo11Af-488
MoKo11Af-488,WINDS OF CHANGE / FUJIN,,Kronika,"Of course, Fujin. How else could you have escaped the Void?",,N,MoKo11Af-487,MoKo11Af-489
MoKo11Af-489,WINDS OF CHANGE / FUJIN,,Raiden,"If you know this, accept the inevitable. Surrender.",,N,MoKo11Af-488,MoKo11Af-490
MoKo11Af-490,WINDS OF CHANGE / FUJIN,,Kronika,"But clearly my loss was not your victory, Raiden. If your future “savior” had gained full control of my Hourglass, we would not be here. This timeline would no longer exist.",,N,MoKo11Af-489,MoKo11Af-491
MoKo11Af-491,WINDS OF CHANGE / FUJIN,,Shang Tsung,I see no harm in confirming your suspicion.,,N,MoKo11Af-490,MoKo11Af-492
MoKo11Af-492,WINDS OF CHANGE / FUJIN,,Kronika,"Even if you defeat me, what then? Who claims the Hourglass? Surely you realize that Shang Tsung will break your alliance.",,N,MoKo11Af-491,MoKo11Af-493
MoKo11Af-493,WINDS OF CHANGE / FUJIN,,Fujin,"We are prepared, Kronika.",,N,MoKo11Af-492,MoKo11Af-494
MoKo11Af-494,WINDS OF CHANGE / FUJIN,,Kronika,Are you? Have you wondered why Shang Tsung knows so much about my Crown?,,N,MoKo11Af-493,MoKo11Af-495
MoKo11Af-495,WINDS OF CHANGE / FUJIN,,Raiden,"Because he did your bidding, gathering souls to fuel it.",,N,MoKo11Af-494,MoKo11Af-496
MoKo11Af-496,WINDS OF CHANGE / FUJIN,,Kronika,"Shang Tsung is far too modest. The Crown is his design. No one, save me, know more about its power.",,N,MoKo11Af-495,MoKo11Af-497
MoKo11Af-497,WINDS OF CHANGE / FUJIN,,,[Kronika's words make Fujin suspicious.],,Y,MoKo11Af-496,MoKo11Af-498
MoKo11Af-498,WINDS OF CHANGE / FUJIN,,Shang Tsung,"Had I told you, we would still be marooned at the beginning of time bickering among ourselves.",,N,MoKo11Af-497,MoKo11Af-499
MoKo11Af-499,WINDS OF CHANGE / FUJIN,,Kronika,"You must decide, Raiden. Who do you wish to keep Time for all of creation? Me, or Shang Tsung?",,N,MoKo11Af-498,MoKo11Af-500
MoKo11Af-500,WINDS OF CHANGE / FUJIN,,Raiden,"Neither, Kronika. You will be beaten. And if Shang Tsung betrays us, we will finish him.",,N,MoKo11Af-499,MoKo11Af-501
MoKo11Af-501,WINDS OF CHANGE / FUJIN,,Kronika,"You are a fool, Raiden. Do not condemn the realms to oblivion!",,N,MoKo11Af-500,MoKo11Af-502
MoKo11Af-502,WINDS OF CHANGE / FUJIN,,,"[Raiden attacks Kronika with lightning and she freezes him in time. She fights Fujin and Shang Tsung. During the battle, the crown falls out of Fujin's bag (or where he kept it, we are not shown).]",,Y,MoKo11Af-501,MoKo11Af-503
MoKo11Af-503,WINDS OF CHANGE / FUJIN,,Shang Tsung,"Fujin, the Crown!",,N,MoKo11Af-502,MoKo11Af-504
MoKo11Af-504,WINDS OF CHANGE / FUJIN,,Kronika,"It is a mistake, challenging a Titan! Now I end your existence!",,N,MoKo11Af-503,MoKo11Af-505
MoKo11Af-505,WINDS OF CHANGE / FUJIN,,,"[Fujin crawls to the crown and puts it on. He is gripped by a terrible pain, but he brings it up and stops the whirlwind of time with one wave of his hands.]",,Y,MoKo11Af-504,MoKo11Af-506
MoKo11Af-506,WINDS OF CHANGE / FUJIN,,Super Fujin,"You are vulnerable, Kronika.",,N,MoKo11Af-505,MoKo11Af-507
MoKo11Af-507,WINDS OF CHANGE / FUJIN,,,[Shang Tsung is calling for some demons to drag Kronika underground. Super Fujin conjures up a vortex that helps demons. Finally Raiden woke up and hit her with his lightning. Kronika turns into a handful of sand. The crown flies off Fujin's head and he falls to the ground. The other heroes are unfreezing.],,Y,MoKo11Af-506,MoKo11Af-508
MoKo11Af-508,WINDS OF CHANGE / FUJIN,,Raiden,Brother! Are you all right?,,N,MoKo11Af-507,MoKo11Af-509
MoKo11Af-509,WINDS OF CHANGE / FUJIN,,Fujin,Yes… But the Crown…,,N,MoKo11Af-508,MoKo11Af-510
MoKo11Af-510,WINDS OF CHANGE / FUJIN,,,[But… Shang Tsung already has it.],,Y,MoKo11Af-509,MoKo11Af-511
MoKo11Af-511,WINDS OF CHANGE / FUJIN,,Shang Tsung,"Truly, my finest work.",,N,MoKo11Af-510,MoKo11Af-512
MoKo11Af-512,WINDS OF CHANGE / FUJIN,,,"[Raiden is slowly approaching him. After looking at the crown a little bit, Shang Tsung gives it to Raiden.]",,Y,MoKo11Af-511,MoKo11Af-513
MoKo11Af-513,WINDS OF CHANGE / FUJIN,,Shang Tsung,I will instruct you in its ways.,,N,MoKo11Af-512,MoKo11Af-514
MoKo11Af-514,WINDS OF CHANGE / FUJIN,,Young Liu Kang,What just happened!?,,N,MoKo11Af-513,MoKo11Af-515
MoKo11Af-515,WINDS OF CHANGE / FUJIN,,Shang Tsung,Kronika came here to retrieve the Crown. We forced her to retreat.,,N,MoKo11Af-514,MoKo11Af-516
MoKo11Af-516,WINDS OF CHANGE / FUJIN,,Raiden,"We must strike while she is weakened. Let us in the armies massing at the Sea of Blood. Together, we will storm Kronika's Isle and take command of the Hourglass.",,N,MoKo11Af-515,MoKo11Af-517
MoKo11Af-518,WINDS OF CHANGE / FUJIN,,,"[Sindel sits in the palace and listens to Shang Tsung through a magical device, nodding a purple glow. You can't see the sorcerer himself, though you can recognize his sly—ass crook voice anywhere.]",,Y,MoKo11Af-517,MoKo11Af-519
MoKo11Af-519,WINDS OF CHANGE / FUJIN,,Voice of Shang Tsung,We will rendezvous at the Isle of Kronika. The fools believe victory is at hand. Their misplaced confidence will be their demise.,,N,MoKo11Af-518,MoKo11Af-520
MoKo11Af-520,WINDS OF CHANGE / FUJIN,,Sindel,Such a pity my daughter embraces their sentimental values…,,N,MoKo11Af-519,MoKo11Af-521
MoKo11Af-521,WINDS OF CHANGE / FUJIN,,Voice of Shang Tsung,"Having second thoughts, Sindel?",,N,MoKo11Af-520,MoKo11Af-522
MoKo11Af-522,WINDS OF CHANGE / FUJIN,,Sindel,Hardly. Kitana courts a peasant and obeys the Thunder God. She couldn't be a bigger disappointment.,,N,MoKo11Af-521,MoKo11Af-523
MoKo11Af-523,WINDS OF CHANGE / FUJIN,,,[Now we finally see the sorcerer himself.],,Y,MoKo11Af-522,MoKo11Af-524
MoKo11Af-524,WINDS OF CHANGE / FUJIN,,Voice of Shang Tsung,One can only imagine. The Isle… Do not be late. An eternal empire awaits you…,,N,MoKo11Af-523,MoKo11Af-525
MoKo11Af-525,WINDS OF CHANGE / FUJIN,,,[Sindel smiles and finishes the transmission. Someone knocks at the door.],,Y,MoKo11Af-524,MoKo11Af-526
MoKo11Af-526,WINDS OF CHANGE / FUJIN,,Sindel,Enter. Kitana Kahn.,,N,MoKo11Af-525,MoKo11Af-527
MoKo11Af-527,WINDS OF CHANGE / FUJIN,,,[She bows.],,Y,MoKo11Af-526,MoKo11Af-528
MoKo11Af-528,WINDS OF CHANGE / FUJIN,,Kitana Kahn,"Don't be so formal, Mother.",,N,MoKo11Af-527,MoKo11Af-529
MoKo11Af-529,WINDS OF CHANGE / FUJIN,,Sindel,"You are Kahn, Kitana. Command the awe of your subjects! Even me. I shall never tire of greeting you.",,N,MoKo11Af-528,MoKo11Af-530
MoKo11Af-530,WINDS OF CHANGE / FUJIN,,Kitana Kahn,Nor will tire of calling on you. Our battalion is leaving for the Sea of Blood. Queen Sheeva and the Shokan will follow as rear guard.,,N,MoKo11Af-529,MoKo11Af-531
MoKo11Af-531,WINDS OF CHANGE / FUJIN,,Sindel,May I request something?,,N,MoKo11Af-530,MoKo11Af-532
MoKo11Af-532,WINDS OF CHANGE / FUJIN,,Kitana Kahn,"Mother, you don't have to—",,N,MoKo11Af-531,MoKo11Af-533
MoKo11Af-533,WINDS OF CHANGE / FUJIN,,,[Sindel looks at her.],,Y,MoKo11Af-532,MoKo11Af-534
MoKo11Af-534,WINDS OF CHANGE / FUJIN,,Kitana Kahn,Make your request.,,N,MoKo11Af-533,MoKo11Af-535
MoKo11Af-535,WINDS OF CHANGE / FUJIN,,Sindel,Sheeva—Queen Sheeva risked everything to restore me. Honor demands that accompany her into battle.,,N,MoKo11Af-534,MoKo11Af-536
MoKo11Af-536,WINDS OF CHANGE / FUJIN,,Kitana Kahn,"Yes, it does. And that display of loyalty is sure to rally the Shokan's spirits.",,N,MoKo11Af-535,MoKo11Af-537
MoKo11Af-537,WINDS OF CHANGE / FUJIN,,Sindel,"Thank you, Kitana Kahn.",,N,MoKo11Af-536,MoKo11Af-538
MoKo11Af-538,WINDS OF CHANGE / FUJIN,,,"[She bows and then they hug. Later, Sindel decides to visit her husband in the dungeons. Two guards are beating him up, and preparing to kill him.]",,Y,MoKo11Af-537,MoKo11Af-539
MoKo11Af-539,WINDS OF CHANGE / FUJIN,,Guard,Doesn't know when to quit. Let's finish him.,,N,MoKo11Af-538,MoKo11Af-540
MoKo11Af-540,WINDS OF CHANGE / FUJIN,,,[Sindel screams at them and rips flesh from their bones.],,Y,MoKo11Af-539,MoKo11Af-541
MoKo11Af-541,WINDS OF CHANGE / FUJIN,,Shao Kahn,Wife. It's you.,,N,MoKo11Af-540,MoKo11Af-542
MoKo11Af-542,WINDS OF CHANGE / FUJIN,,,[Apparently he was blinded.],,Y,MoKo11Af-541,MoKo11Af-543
MoKo11Af-543,WINDS OF CHANGE / FUJIN,,Sindel,"Hush, husband, I'm here. The Soul Chamber will heal your wounds. Then we'll discipline Kitana and take back our throne.",,N,MoKo11Af-542,MoKo11Af-544
MoKo11Af-544,WINDS OF CHANGE / FUJIN,,,[She hug him. Suddenly Sheeva enters the dungeons.],,Y,MoKo11Af-543,MoKo11Af-545
MoKo11Af-545,WINDS OF CHANGE / FUJIN,,Sheeva,Empress? Tell me misheard. Tell me you would not betray your daughter.,,N,MoKo11Af-544,MoKo11Af-546
MoKo11Af-546,WINDS OF CHANGE / FUJIN,,Sindel,"She takes after her father, Sheeva. Jerrod was a weak king, Kitana is a weaker Kahn.",,N,MoKo11Af-545,MoKo11Af-547
MoKo11Af-547,WINDS OF CHANGE / FUJIN,,Sheeva,Weak?! She defeated Shao Kahn!,,N,MoKo11Af-546,MoKo11Af-548
MoKo11Af-548,WINDS OF CHANGE / FUJIN,,Sindel,"Yet she lacked the resolve to kill him! Now she will learn. Enemies must be crushed, lest they rise again.",,N,MoKo11Af-547,MoKo11Af-549
MoKo11Af-549,WINDS OF CHANGE / FUJIN,,Sheeva,"That was true, once. But now there is a better way to lead.",,N,MoKo11Af-548,MoKo11Af-550
MoKo11Af-550,WINDS OF CHANGE / FUJIN,,,[SINDEL VS SHEEVA],,Y,MoKo11Af-549,MoKo11Af-551
MoKo11Af-551,WINDS OF CHANGE / FUJIN,,Sindel,"Elder Gods tremble before me, Sheeva. What hope did you have?",,N,MoKo11Af-550,MoKo11Af-552
MoKo11Af-552,WINDS OF CHANGE / FUJIN,,,[A few Shokan enters the dungeon and sees an unconscious Sheeva.],,Y,MoKo11Af-551,MoKo11Af-553
MoKo11Af-553,WINDS OF CHANGE / FUJIN,,Sindel,Kitana murdered your Shokan brethren. Sheeva challenged her and suffered this punishment. Swear your allegiance and I shall see her avenged!,,N,MoKo11Af-552,MoKo11Af-554
MoKo11Af-554,WINDS OF CHANGE / FUJIN,,,[They bow. Sindel takes Shao Kahn to the Soul Chamber. He restores his health and wears his iconic helmet. They hug.],,Y,MoKo11Af-553,MoKo11Af-555
MoKo11Af-555,WINDS OF CHANGE / FUJIN,,Shao Kahn,"Wife, I have missed you. If Quan Chi were here, I'd hoist him by the ankles, and split him through for all the time he stole from us…",,N,MoKo11Af-554,MoKo11Af-556
MoKo11Af-556,WINDS OF CHANGE / FUJIN,,Sindel,Soon we will have the Hourglass. Eternity will be our empire.,,N,MoKo11Af-555,MoKo11Af-557
MoKo11Af-557,WINDS OF CHANGE / FUJIN,,Shao Kahn,We'll have all the time we need.,,N,MoKo11Af-556,MoKo11Af-558
MoKo11Af-558,WINDS OF CHANGE / FUJIN,,,"[The room opens a portal from which Geras comes out wearing a new, cool hat, making him look like a superhero.]",,Y,MoKo11Af-557,MoKo11Af-559
MoKo11Af-559,WINDS OF CHANGE / FUJIN,,Geras,"Shao Kahn, Sindel. Come with me. Kronika has need of you.",,N,MoKo11Af-558,MoKo11Af-560
MoKo11Af-560,WINDS OF CHANGE / FUJIN,,Shao Kahn,Kronika?! Where was she when Kitana stole my throne? We'll make her choke on her empty promises.,,N,MoKo11Af-559,MoKo11Af-561
MoKo11Af-561,WINDS OF CHANGE / FUJIN,,,[You can choose your fighter — Sindel or Shao Kahn.],,Y,MoKo11Af-560,MoKo11Af-562
